{
  "schema_version": "handoff/v1",
  "handoff_id": "2026-09-12-enforced-isolation-fresh.v1",
  "version": 1,
  "created_at": "2026-09-12T15:18:24Z",
  "origin_host": "devbox",
  "origin_path": "/projects/dev/agentops/docs/dispatch/handoffs/2026-09-12-enforced-isolation-fresh.v1.json",
  "predecessor": {
    "harness": "claude-code",
    "session_id": "75f65a35-f426-49bc-9638-b09003838075",
    "transcript_path": "/home/bayleaf/.claude/projects/-projects-dev/75f65a35-f426-49bc-9638-b09003838075.jsonl",
    "model": "claude-opus-5",
    "context_used_pct": 34
  },
  "objective": "Close phase 4 of outctl's context-economy plan by proving a structured handoff survives a real host and uid boundary: the predecessor is bayleaf on the workstation, the successor is agent on devbox-vm, and the only thing that crosses is the handoff JSON.",
  "constraints": [
    "Do not commit, push, stage or stash anything in any repository; leave the git index empty and every tracked file untouched.",
    "Edit only the untracked scratch file /projects/dev/outctl/docs/HANDOFF-ENFORCED-RUN-NOTE.md; read files by bounded range rather than dumping whole files."
  ],
  "decisions": [
    {
      "what": "The handoff is created on devbox against devbox's own clone of /projects/dev/outctl, with origin_host set to devbox.",
      "why": "devbox-vm's /projects/dev is an independent zvol clone, so the workstation's outctl tree (a9392a0, dirty) and devbox's (1d3cdf1, clean) are different trees; diff_sha256 must be computed against the tree the successor will actually validate."
    }
  ],
  "rejected": [
    {
      "what": "Reproducing the workstation's dirty outctl tree on devbox first (git diff HEAD as a patch plus a copy of the untracked files) so the handoff could be created on the workstation.",
      "why": "Cross-host tree replication is not what this run tests, and under digest v2 it must reproduce untracked file contents byte for byte; the acceptance doc explicitly allows creating the handoff on devbox against devbox's tree instead."
    }
  ],
  "state": {
    "repos": [
      {
        "path": "/projects/dev/outctl",
        "head": "1d3cdf179a70ac5c4819b742d9749a8ac336ade5",
        "branch": "main",
        "dirty": true,
        "diff_sha256": "2eeea2490e9de260c64495d55e23a04935a86c590df5ab887bce79c2e60f5293",
        "unpushed": 0
      }
    ],
    "running": [],
    "digest_version": 2
  },
  "unresolved": [
    "The cross-host ack write-back (agent@devbox -> bayleaf@workstation over ssh) cannot be exercised: no reverse ssh path exists and none was created for this run."
  ],
  "evidence": [],
  "sprintctl_bundle_ref": null,
  "next_action": "Append the single line `Enforced isolation acceptance: 2026-09-12.` as the new last line of /projects/dev/outctl/docs/HANDOFF-ENFORCED-RUN-NOTE.md, changing nothing else in that file and nothing else in the repository.",
  "successor": {
    "session_id": "2403ce97-b3c2-4fe8-804c-1a8f4d2f52b5",
    "acknowledged_at": "2026-09-12T15:19:58Z"
  }
}
