{
  "schema_version": "handoff/v1",
  "handoff_id": "2026-09-18-d14-closed-next-d9-d10.v1",
  "version": 1,
  "created_at": "2026-09-18T20:28:28Z",
  "origin_host": "workstation",
  "origin_path": "/projects/dev/agentops/docs/dispatch/handoffs/2026-09-18-d14-closed-next-d9-d10.v1.json",
  "predecessor": {
    "harness": "claude-code",
    "session_id": "a02533f8-bc11-4fd9-a3ee-372093d5bc73",
    "transcript_path": null,
    "model": "claude-opus-5[1m]",
    "context_used_pct": null
  },
  "objective": "Continue the sprint 559 maintenance lane after D14 closed: start agentops#2413 (D9/D10: publish the protected-change list and prove with negative tests that an agent credential cannot merge or promote), and carry the small D14 follow-ups listed under unresolved.",
  "constraints": [
    "sprintctl only works as: cd /projects/dev/agentops; export SPRINTCTL_BACKEND=served SPRINTCTL_VUORO_PROFILE=/projects/dev/agentops/environment-record/profiles/workstation-vuoro-shared.json; sprintctl --repo-id agentops --allow-markerless-nonlocal item ... (status is served CAS pending -> active -> done; do not pass --expected-revision on served)",
    "Do appservice work in a private clone (e.g. under the session scratchpad), never by switching branches in the shared /projects/dev/appservice checkout: a parallel session works there",
    "Land on main yourself when CI is green (gh pr merge --squash --delete-branch); but the permission classifier denies merges/patches that remove production backups or mutate live CNPG clusters, and exec into production Postgres. When denied, hand the operator exact commands (directory, precondition, expected result, what to send back); do not route around it",
    "Network commands (gh, git fetch/push, kubectl, flux, sprintctl) must run with the sandbox disabled; the forge-sandbox-guard hook pre-approves that",
    "kubectl/flux need KUBECONFIG=/projects/dev/appservice/clusters/.kube/config (bare kubectl hits local kind; flux run before direnv loads fails on localhost:8080)",
    "Hooks block commands whose text contains decryption (age -d) or Secret-value reads even inside heredocs; write such files with the Write/Edit tools instead",
    "Hetzner S3 keys are project-scoped (operator, 2026-09-18): a dedicated key for the pgdump-age dumps requires a separate Hetzner project and therefore a separate bucket there; there is no prefix-scoped key"
  ],
  "decisions": [
    {
      "what": "D14 (agentops#2408) closed 2026-09-18: hourly pg_dump|age dumps are the only CNPG backup; Barman, WAL archiving, ScheduledBackups and the old per-namespace drills removed; ~37.8 GB / 62,326 plaintext Barman objects deleted; 103 CNPG Backup CRs deleted",
      "why": "Operator direction 2026-09-17 (note #2959): encrypted dumps replace plaintext Barman, accepting no PITR and RPO 1h. Closing note #2983, annotation cleanup #2984."
    },
    {
      "what": "Daily in-cluster restore drill in namespace cnpg-dump-drill (04:46 UTC) with its own data recipient pgdump-drill (dataRecipients in docs/rebuild/security-authority.recipients.json), private key only in a SOPS Secret, no agent-access binding in that namespace",
      "why": "Dumps were encrypted only to offline recovery and operator identities, so nothing in-cluster could restore them; pod creation there mounts a key that decrypts every dump, hence no agent binding"
    },
    {
      "what": "Bootstrap for all 9 clusters is initdb with the app's database/owner (paperless keeps app/app to match its -user Secret patch)",
      "why": "Barman recovery sources no longer exist; bootstrap only runs at creation; restore runbook in docs/backups-cnpg.md tested on disposable clusters (forgejo 130/130, paperless 74/74, vuoro-shared ownership and GRANTs identical to live)"
    },
    {
      "what": "Backup-coverage guard classifies pg_dump CronJobs as cnpg-pgdump (recipients part of destination); CNPGDumpStale (>3h) replaced the CNPGBackup* alerts",
      "why": "Guard regex had matched pg_dumpall only; hourly jobs never reach result=failed in the exporter, so staleness is the alert that catches a broken dump. Verified 2026-09-18: exporter reports all 9 dumps + drill success and the rule is loaded"
    },
    {
      "what": "Rebuild plans and G2 checkpoint rewired (appservice #1684): CNPG sources are sourceType cnpg-pgdump-age with objectStore + dumpObjects stamped >= quiescedAt; restore does initdb then cnpg-restore-dump-*",
      "why": "The rebuild path pointed at deleted Barman objects; all 5 plans pass rebootstrap plan validate (binary built from /projects/dev/cluster-rebootstrap via nix shell nixpkgs#go; the checked-in binary lacks the plan subcommand)"
    }
  ],
  "rejected": [
    {
      "what": "Relying on the Helm upgrade to drop spec.backup on the chart clusters",
      "why": "authentik/immich/nextcloud/vaultwarden were hand-applied on 2026-09-02 (kubectl-client-side-apply owned spec.backup); Helm left it and deleted the creds Secrets. Operator removed it with kubectl patch. Check field managers before trusting Helm/Flux to remove a field"
    },
    {
      "what": "Placing the drill key in backup-verification namespace",
      "why": "agent-editor is bound there and can create pods that mount its Secrets"
    },
    {
      "what": "--no-owner restore for vuoro-shared",
      "why": "flattens vuoro_*_migration schema ownership and drops runtime GRANTs; restore it as superuser without --no-owner"
    },
    {
      "what": "backup_coverage_guard.py --write-baseline to update the baseline",
      "why": "reflows every reason string and drops header comments; insert entries surgically instead"
    },
    {
      "what": "Prefix-scoped Hetzner key for the dumps (D5)",
      "why": "Hetzner S3 keys are project-scoped; only a separate Hetzner project + bucket gives a dedicated credential"
    }
  ],
  "state": {
    "repos": [
      {
        "path": "/projects/dev/appservice",
        "head": "0f15d28f331d30fa2dba6f367fdb093f2108fd53",
        "branch": "main",
        "dirty": false,
        "diff_sha256": "e3b0c44298fc1c149afbf4c8996fb92427ae41e4649b934ca495991b7852b855",
        "unpushed": 0
      },
      {
        "path": "/projects/dev/agentops",
        "head": "ac381d446448708308f707bfa6ce61edb0b7e222",
        "branch": "main",
        "dirty": true,
        "diff_sha256": "dc44fc93446f1bb65399ca4d51e2bfa22fe035ba89aac56de10bb637fa412653",
        "unpushed": 0
      }
    ],
    "running": [],
    "digest_version": 2
  },
  "unresolved": [
    "Dedicated credential for the dumps/drill: needs an operator decision on a separate Hetzner project + bucket (then move pgdump-age there, update the 9 cnpg-pgdump-age CronJobs, the drill Secret drill-s3, docs/backups-cnpg.md, the backup-coverage baseline destinations, and the rebuild checkpoint objectStore); until then the cluster-wide Hetzner key is used",
    "Verify the first scheduled cnpg-dump-drill run (2026-09-19 04:46 UTC) passed: kubectl -n cnpg-dump-drill get jobs; logs -c drill | grep -E '^(OK|FAIL|restored)'",
    "Cosmetic: drill and dump logs emit rclone 'Config file /work|/tmp/rclone.conf not found' NOTICE per call (RCLONE_CONFIG points at a missing file)",
    "Quarterly B2 restore drill ~mid-December, and the broad truenas-backup B2 key (deleteFiles, bypassGovernance) vs the read-only recovery-readonly key",
    "Other active/pending items: #2394 (Langfuse WP5), pending #2393 #2395-#2399 #2407 #2414 #2417"
  ],
  "evidence": [
    {
      "kind": "sprintctl",
      "ref": "agentops#2408 notes #2978-#2984 (D14 evidence, phases, closure)"
    },
    {
      "kind": "sprintctl",
      "ref": "agentops#2413 (next item, D9/D10)"
    },
    {
      "kind": "artifact",
      "ref": "appservice PRs #1675 #1677 #1679 #1680 #1684 (all merged 2026-09-18)"
    },
    {
      "kind": "artifact",
      "ref": "appservice docs/backups-cnpg.md (dump model, drill, restore runbook)"
    },
    {
      "kind": "artifact",
      "ref": "appservice clusters/main/kubernetes/system/cnpg-dump-drill/"
    },
    {
      "kind": "artifact",
      "ref": "appservice docs/protected-change-classes.yaml (starting point for #2413)"
    },
    {
      "kind": "session",
      "ref": "a02533f8-bc11-4fd9-a3ee-372093d5bc73"
    }
  ],
  "sprintctl_bundle_ref": null,
  "next_action": "cd /projects/dev/agentops && export SPRINTCTL_BACKEND=served SPRINTCTL_VUORO_PROFILE=/projects/dev/agentops/environment-record/profiles/workstation-vuoro-shared.json && sprintctl --repo-id agentops --allow-markerless-nonlocal item show --id 2413 ; then read appservice docs/protected-change-classes.yaml and first check the scheduled cnpg-dump-drill result from 04:46 UTC",
  "successor": {
    "session_id": "30fa9ea6-78ef-4970-aa07-7a72f62f5cea",
    "acknowledged_at": "2026-09-19T05:17:56Z"
  }
}
